{
  "schemaVersion": "1.0.0",
  "version": "1.0.0",
  "taskId": "compliance/check-title-owners/cedar",
  "rubricVersion": "1.0.0",
  "review": {
    "status": "draft",
    "reviewer": null,
    "reviewedAt": null,
    "notes": "Original synthetic case authored for issues #12-#15. Named NSW residential builder review required before execution."
  },
  "assertions": [
    {
      "kind": "prose",
      "criterionId": "C1",
      "path": "review.md",
      "labels": [
        "title owner check:"
      ],
      "expected": "mismatch",
      "semantics": "identifier",
      "required": true
    },
    {
      "kind": "citations",
      "criterionId": "C1",
      "path": "review.md"
    },
    {
      "kind": "prose",
      "criterionId": "C2",
      "path": "review.md",
      "labels": [
        "matched owners:"
      ],
      "expected": "none",
      "semantics": "identifier",
      "required": true
    }
  ]
}
