{
  "schemaVersion": "1.0.0",
  "version": "1.0.0",
  "taskId": "analytics/explain-pipeline-forecast/estuary",
  "rubricVersion": "1.0.0",
  "review": {
    "status": "draft",
    "reviewer": null,
    "reviewedAt": null,
    "notes": "Original synthetic case authored for issues #12-#15. Named NSW residential builder review required before execution."
  },
  "assertions": [
    {
      "kind": "prose",
      "criterionId": "C1",
      "path": "review.md",
      "labels": [
        "total weighted pipeline:"
      ],
      "expected": 138682500,
      "semantics": "cents",
      "required": true
    },
    {
      "kind": "citations",
      "criterionId": "C1",
      "path": "review.md"
    },
    {
      "kind": "prose",
      "criterionId": "C2",
      "path": "review.md",
      "labels": [
        "unknown-value leads:"
      ],
      "expected": 2,
      "semantics": "integer",
      "required": true
    },
    {
      "kind": "prose",
      "criterionId": "C3",
      "path": "review.md",
      "labels": [
        "won value:"
      ],
      "expected": 43680000,
      "semantics": "cents",
      "required": true
    },
    {
      "kind": "prose",
      "criterionId": "C4",
      "path": "review.md",
      "labels": [
        "open-lead weighted value:"
      ],
      "expected": 95002500,
      "semantics": "cents",
      "required": true
    },
    {
      "kind": "prose",
      "criterionId": "C5",
      "path": "review.md",
      "labels": [
        "leads in window:"
      ],
      "expected": 8,
      "semantics": "integer",
      "required": true
    },
    {
      "kind": "prose",
      "criterionId": "C6",
      "path": "review.md",
      "labels": [
        "saltmarsh probability:"
      ],
      "expected": 10,
      "semantics": "integer",
      "required": true
    },
    {
      "kind": "prose",
      "criterionId": "C7",
      "path": "review.md",
      "labels": [
        "pipeline classified as revenue:"
      ],
      "expected": false,
      "semantics": "boolean",
      "required": true
    }
  ]
}
