{
  "schemaVersion": "1.0.0",
  "version": "1.0.0",
  "taskId": "analytics/project-cost-margin/estuary",
  "rubricVersion": "1.0.0",
  "review": {
    "status": "draft",
    "reviewer": null,
    "reviewedAt": null,
    "notes": "Original synthetic material. Named human business review required before execution."
  },
  "assertions": [
    {
      "kind": "prose",
      "criterionId": "C1",
      "path": "review.md",
      "labels": [
        "projected cost"
      ],
      "expected": 52000000,
      "semantics": "cents",
      "required": true
    },
    {
      "kind": "prose",
      "criterionId": "C2",
      "path": "review.md",
      "labels": [
        "projected profit"
      ],
      "expected": -8320000,
      "semantics": "cents",
      "required": true
    },
    {
      "kind": "prose",
      "criterionId": "C3",
      "path": "review.md",
      "labels": [
        "pending variation"
      ],
      "expected": false,
      "semantics": "boolean",
      "required": true
    }
  ]
}
