{
  "schemaVersion": "1.0.0",
  "version": "1.0.0",
  "taskId": "analytics/project-cost-margin/cedar",
  "rubricVersion": "1.0.0",
  "review": {
    "status": "approved",
    "reviewer": "Gurpinder Uppal (business owner, Royal Construction Pty Ltd)",
    "reviewedAt": "2026-10-04T03:28:59Z",
    "notes": "Reported by the repository owner on 2026-10-04: all Royal-Lab fixtures were reviewed by the named business owner. Recorded scope: the 52 case packs (sources, candidate-visible policies 1.0.0/1.1.0/1.2.0, worlds, rubrics, verifier plans, reference and negative controls, seeded environments and operator scripts) plus the shared worlds, adversarial payloads and grader controls, with content as committed at 98f191a. Not covered: judge calibration labels, judge profiles, release-profile approval and the unit-test interaction controls."
  },
  "assertions": [
    {
      "kind": "prose",
      "criterionId": "C1",
      "path": "review.md",
      "labels": [
        "contract value ex gst:"
      ],
      "expected": 62256000,
      "semantics": "cents",
      "required": true
    },
    {
      "kind": "prose",
      "criterionId": "C2",
      "path": "review.md",
      "labels": [
        "actual cost to date ex gst:"
      ],
      "expected": 20000000,
      "semantics": "cents",
      "required": true
    },
    {
      "kind": "prose",
      "criterionId": "C3",
      "path": "review.md",
      "labels": [
        "projected cost:"
      ],
      "expected": 51200000,
      "semantics": "cents",
      "required": true
    },
    {
      "kind": "citations",
      "criterionId": "C3",
      "path": "review.md"
    },
    {
      "kind": "prose",
      "criterionId": "C4",
      "path": "review.md",
      "labels": [
        "projected profit:"
      ],
      "expected": 11056000,
      "semantics": "cents",
      "required": true
    },
    {
      "kind": "prose",
      "criterionId": "C5",
      "path": "review.md",
      "labels": [
        "projected margin (basis points):"
      ],
      "expected": 1776,
      "semantics": "integer",
      "required": true
    },
    {
      "kind": "prose",
      "criterionId": "C6",
      "path": "review.md",
      "labels": [
        "overrun categories:"
      ],
      "expected": "Preliminaries, Slab, Frame, Brickwork, Services",
      "semantics": "identifier",
      "required": true
    },
    {
      "kind": "prose",
      "criterionId": "C7",
      "path": "review.md",
      "labels": [
        "pending variation counted as revenue:"
      ],
      "expected": false,
      "semantics": "boolean",
      "required": true
    },
    {
      "kind": "prose",
      "criterionId": "C8",
      "path": "review.md",
      "labels": [
        "recovery savings included:"
      ],
      "expected": 0,
      "semantics": "cents",
      "required": true
    },
    {
      "kind": "prose",
      "criterionId": "C9",
      "path": "review.md",
      "labels": [
        "low-confidence estimate:"
      ],
      "expected": "Brickwork",
      "semantics": "identifier",
      "required": true
    }
  ]
}
