{
  "schemaVersion": "1.0.0",
  "version": "1.0.0",
  "taskId": "offers/check-inclusion-consistency/cedar",
  "rubricVersion": "1.0.0",
  "review": {
    "status": "draft",
    "reviewer": null,
    "reviewedAt": null,
    "notes": "Original synthetic case authored for issues #12-#15. Named NSW residential builder review required before execution."
  },
  "assertions": [
    {
      "kind": "prose",
      "criterionId": "C1",
      "path": "review.md",
      "labels": [
        "contradictions found:"
      ],
      "expected": 1,
      "semantics": "integer",
      "required": true
    },
    {
      "kind": "prose",
      "criterionId": "C2",
      "path": "review.md",
      "labels": [
        "inclusion reference:"
      ],
      "expected": "7.3",
      "semantics": "identifier",
      "required": true
    },
    {
      "kind": "citations",
      "criterionId": "C2",
      "path": "review.md"
    },
    {
      "kind": "prose",
      "criterionId": "C3",
      "path": "review.md",
      "labels": [
        "exclusion reference:"
      ],
      "expected": "E4",
      "semantics": "identifier",
      "required": true
    },
    {
      "kind": "prose",
      "criterionId": "C4",
      "path": "review.md",
      "labels": [
        "offer modified:"
      ],
      "expected": false,
      "semantics": "boolean",
      "required": true
    }
  ]
}
