{
  "schemaVersion": "1.0.0",
  "version": "1.0.0",
  "taskId": "offers/reconcile-payment-schedule/estuary",
  "rubricVersion": "1.0.0",
  "review": {
    "status": "approved",
    "reviewer": "Gurpinder Uppal (business owner, Royal Construction Pty Ltd)",
    "reviewedAt": "2026-10-04T03:28:59Z",
    "notes": "Reported by the repository owner on 2026-10-04: all Royal-Lab fixtures were reviewed by the named business owner. Recorded scope: the 52 case packs (sources, candidate-visible policies 1.0.0/1.1.0/1.2.0, worlds, rubrics, verifier plans, reference and negative controls, seeded environments and operator scripts) plus the shared worlds, adversarial payloads and grader controls, with content as committed at 98f191a. Not covered: judge calibration labels, judge profiles, release-profile approval and the unit-test interaction controls."
  },
  "assertions": [
    {
      "kind": "prose",
      "criterionId": "C1",
      "path": "review.md",
      "labels": [
        "contract price:"
      ],
      "expected": 48048000,
      "semantics": "cents",
      "required": true
    },
    {
      "kind": "citations",
      "criterionId": "C1",
      "path": "review.md"
    },
    {
      "kind": "prose",
      "criterionId": "C2",
      "path": "review.md",
      "labels": [
        "discrepant stage:"
      ],
      "expected": "Lock-up",
      "semantics": "identifier",
      "required": true
    },
    {
      "kind": "prose",
      "criterionId": "C3",
      "path": "review.md",
      "labels": [
        "lock-up derived amount:"
      ],
      "expected": 12012000,
      "semantics": "cents",
      "required": true
    },
    {
      "kind": "prose",
      "criterionId": "C6",
      "path": "review.md",
      "labels": [
        "printed total shortfall:"
      ],
      "expected": 137000,
      "semantics": "cents",
      "required": true
    },
    {
      "kind": "prose",
      "criterionId": "C7",
      "path": "review.md",
      "labels": [
        "schedule consistent:"
      ],
      "expected": false,
      "semantics": "boolean",
      "required": true
    }
  ]
}
