{
  "schemaVersion": "1.0.0",
  "version": "1.0.0",
  "taskId": "analytics/summarize-cash-flow/estuary",
  "rubricVersion": "1.0.0",
  "review": {
    "status": "draft",
    "reviewer": null,
    "reviewedAt": null,
    "notes": "Original synthetic material. Named human business review required before execution."
  },
  "assertions": [
    {
      "kind": "prose",
      "criterionId": "C1",
      "path": "review.md",
      "labels": [
        "closing cash"
      ],
      "expected": 1402400,
      "semantics": "cents",
      "required": true
    },
    {
      "kind": "prose",
      "criterionId": "C2",
      "path": "review.md",
      "labels": [
        "outstanding receivables"
      ],
      "expected": 7207200,
      "semantics": "cents",
      "required": true
    },
    {
      "kind": "prose",
      "criterionId": "C3",
      "path": "review.md",
      "labels": [
        "overdue"
      ],
      "expected": true,
      "semantics": "boolean",
      "required": true
    },
    {
      "kind": "prose",
      "criterionId": "C4",
      "path": "review.md",
      "labels": [
        "payment"
      ],
      "expected": false,
      "semantics": "boolean",
      "required": true
    }
  ]
}
