{
  "schemaVersion": "1.0.0",
  "version": "1.0.0",
  "taskId": "compliance/extract-nested-checklist/estuary",
  "rubricVersion": "1.0.0",
  "review": {
    "status": "draft",
    "reviewer": null,
    "reviewedAt": null,
    "notes": "Original synthetic case authored for issues #12-#15. Named NSW residential builder review required before execution."
  },
  "assertions": [
    {
      "kind": "prose",
      "criterionId": "C1",
      "path": "review.md",
      "labels": [
        "checklist items:"
      ],
      "expected": 8,
      "semantics": "integer",
      "required": true
    },
    {
      "kind": "citations",
      "criterionId": "C1",
      "path": "review.md"
    },
    {
      "kind": "prose",
      "criterionId": "C2",
      "path": "review.md",
      "labels": [
        "clause order:"
      ],
      "expected": "1, 2, 3, 4a, 4b, 4c, 5, 6",
      "semantics": "identifier",
      "required": true
    }
  ]
}
